{
  "prescriptionId": "RX-M07-GRADED-ACTIVITY",
  "version": "1.0.0",
  "status": "approved",
  "applicableModules": ["M07"],
  "applicableFunctionalLevels": ["F3", "F4", "F5"],
  "goals": ["保持日常活动并减少因疼痛导致的回避", "改善躯干与下肢功能耐力", "提高转移、站立或步行相关活动能力"],
  "trainingName": "慢性腰痛分级活动与功能练习",
  "startPosition": "舒适坐位或站位；根据功能等级提供稳定支撑和近身保护",
  "steps": [
    "治疗师确认不存在需要医疗评估的红旗，并了解疼痛对活动的影响。",
    "选择可接受的腰盆活动、呼吸放松和躯干控制练习，不追求单一固定动作模式。",
    "结合坐站、短距离步行、取放物品或其他与个人目标相关的功能任务进行分级练习。",
    "逐步增加活动时间、重复次数或任务复杂度，每次只调整一个主要变量。",
    "提供保持正常活动和自我管理教育，记录活动后症状变化与恢复时间。"
  ],
  "dose": {
    "repetitions": { "value": "每项6～12次，或按功能任务完成质量调整", "unit": "次", "reviewStatus": "approved" },
    "sets": { "value": "1～3", "unit": "组", "reviewStatus": "approved" },
    "duration": { "value": "15～30", "unit": "分钟/次", "reviewStatus": "approved" },
    "frequency": { "value": "每周3～5天；日常活动按耐受持续进行", "unit": null, "reviewStatus": "approved" },
    "intensity": { "value": "低至中等强度，主观用力约3～5/10；症状反应应可接受并能恢复", "unit": null, "reviewStatus": "approved" }
  },
  "equipment": ["稳定椅", "步行辅助器具（如已评估需要）", "弹力带（可选）"],
  "assistanceLevels": ["A0", "A1", "A2", "A3", "AX"],
  "executorRoles": ["therapist"],
  "contraindications": [
    { "code": "LBP-RED-FLAG", "label": "存在新发严重症状、进行性神经功能变化或其他未排除红旗", "reviewStatus": "approved" },
    { "code": "MEDICALLY-UNSTABLE", "label": "医学状态不稳定或治疗师未确认可安全活动", "reviewStatus": "approved" }
  ],
  "precautions": [
    { "code": "SYMPTOM-MONITORING", "label": "监测疼痛性质、放射症状、神经变化、跌倒风险及活动后恢复", "reviewStatus": "approved" },
    { "code": "NO-PASSIVE-ONLY-PACKAGE", "label": "不得用单一被动治疗替代活动、自我管理和功能训练", "reviewStatus": "approved" }
  ],
  "terminationCriteria": [
    { "code": "NEW-NEUROLOGICAL-CHANGE", "label": "出现新发或进行性无力、感觉变化、大小便功能异常或鞍区感觉异常", "reviewStatus": "approved" },
    { "code": "SEVERE-SYMPTOM", "label": "出现新发严重疼痛、胸腹部症状、晕厥或其他红旗表现", "reviewStatus": "approved" },
    { "code": "UNACCEPTABLE-RESPONSE", "label": "症状明显加重且休息或调整后不能恢复到可接受水平", "reviewStatus": "approved" }
  ],
  "progressionCriteria": [
    { "code": "ACTIVITY-TOLERANCE", "label": "当前活动量完成后症状可接受，且功能和信心改善", "reviewStatus": "approved" }
  ],
  "regressionCriteria": [
    { "code": "PERSISTENT-FLARE", "label": "活动后症状持续加重、睡眠或次日功能明显受影响", "reviewStatus": "approved" }
  ],
  "alternatives": ["缩短步行或任务持续时间", "由站位改为坐位躯干和下肢练习", "减少动作范围或外阻力"],
  "reassessmentMeasures": ["疼痛强度与活动相关变化", "患者特异性功能量表", "坐站与步行耐受", "日常活动参与", "跌倒风险指标"],
  "evidenceSources": [
    { "sourceId": "NICE-NG59", "citation": "NICE NG59. Low back pain and sciatica in over 16s: assessment and management. Recommendations 1.2.1-1.2.7.", "verificationStatus": "verified" }
  ],
  "audienceContent": {
    "therapist": "正式处方库版本：以保持活动、个体化运动和目标相关功能练习为主；不得将牵引或常规电疗作为本处方内容。",
    "caregiver": "仅执行治疗师针对本次评估确认的分级活动，不自行增加动作、阻力或训练时长。",
    "residentFamily": "方案强调在安全范围内保持活动；出现终止标准所列症状时立即停止并报告。"
  },
  "clinicalReview": { "status": "approved", "reviewerUserId": "therapist", "reviewedAt": "2026-08-21T01:00:21Z" }
}
